{
  "id": "knowledge.primary-care-swallowing-difficulty",
  "version": "0.1.0",
  "nodes": [
    {
      "id": "context.primary_care",
      "type": "EncounterContext",
      "display": "Primary Care",
      "version": "0.1.0",
      "status": "research_only",
      "provenance": {
        "created_by": {
          "type": "ai",
          "id": "codex-gpt5"
        },
        "created_at": "2026-07-14T00:00:00Z",
        "source_refs": [
          "docs/context/002-encounter-context.md"
        ],
        "review_status": "unreviewed",
        "version": "0.1.0"
      }
    },
    {
      "id": "rfe.swallowing_difficulty",
      "type": "ReasonForEncounter",
      "display": "Swallowing Difficulty",
      "version": "0.1.0",
      "status": "research_only",
      "provenance": {
        "created_by": {
          "type": "ai",
          "id": "codex-gpt5"
        },
        "created_at": "2026-07-14T00:00:00Z",
        "source_refs": [
          "knowledge/catalog/primary-care-rfe.json"
        ],
        "review_status": "unreviewed",
        "version": "0.1.0"
      }
    },
    {
      "id": "intent.characterize_swallowing_difficulty",
      "type": "ClinicalIntent",
      "display": "Characterize Swallowing Difficulty",
      "version": "0.1.0",
      "status": "research_only",
      "provenance": {
        "created_by": {
          "type": "ai",
          "id": "codex-gpt5"
        },
        "created_at": "2026-07-14T00:00:00Z",
        "source_refs": [
          "docs/context/001-clinical-intent.md"
        ],
        "review_status": "unreviewed",
        "version": "0.1.0"
      }
    },
    {
      "id": "intent.screen_swallowing_safety",
      "type": "ClinicalIntent",
      "display": "Screen Swallowing Safety",
      "version": "0.1.0",
      "status": "research_only",
      "provenance": {
        "created_by": {
          "type": "ai",
          "id": "codex-gpt5"
        },
        "created_at": "2026-07-14T00:00:00Z",
        "source_refs": [
          "docs/context/001-clinical-intent.md"
        ],
        "review_status": "unreviewed",
        "version": "0.1.0"
      }
    },
    {
      "id": "intent.assess_swallowing_impact_and_context",
      "type": "ClinicalIntent",
      "display": "Assess Swallowing Impact and Context",
      "version": "0.1.0",
      "status": "research_only",
      "provenance": {
        "created_by": {
          "type": "ai",
          "id": "codex-gpt5"
        },
        "created_at": "2026-07-14T00:00:00Z",
        "source_refs": [
          "docs/context/001-clinical-intent.md"
        ],
        "review_status": "unreviewed",
        "version": "0.1.0"
      }
    },
    {
      "id": "intent.prepare_swallowing_handoff",
      "type": "ClinicalIntent",
      "display": "Prepare Swallowing Handoff",
      "version": "0.1.0",
      "status": "research_only",
      "provenance": {
        "created_by": {
          "type": "ai",
          "id": "codex-gpt5"
        },
        "created_at": "2026-07-14T00:00:00Z",
        "source_refs": [
          "docs/context/001-clinical-intent.md"
        ],
        "review_status": "unreviewed",
        "version": "0.1.0"
      }
    }
  ],
  "edges": [
    {
      "id": "edge.swallowing-difficulty.000",
      "type": "ACTIVATES",
      "from": "context.primary_care",
      "to": "intent.characterize_swallowing_difficulty",
      "version": "0.1.0",
      "provenance": {
        "created_by": {
          "type": "ai",
          "id": "codex-gpt5"
        },
        "created_at": "2026-07-14T00:00:00Z",
        "source_refs": [
          "docs/context/002-encounter-context.md"
        ],
        "review_status": "unreviewed",
        "version": "0.1.0"
      }
    },
    {
      "id": "edge.swallowing-difficulty.001",
      "type": "SUGGESTS",
      "from": "rfe.swallowing_difficulty",
      "to": "intent.characterize_swallowing_difficulty",
      "version": "0.1.0",
      "provenance": {
        "created_by": {
          "type": "ai",
          "id": "codex-gpt5"
        },
        "created_at": "2026-07-14T00:00:00Z",
        "source_refs": [
          "docs/context/001-clinical-intent.md"
        ],
        "review_status": "unreviewed",
        "version": "0.1.0"
      }
    },
    {
      "id": "edge.swallowing-difficulty.002",
      "type": "SUGGESTS",
      "from": "rfe.swallowing_difficulty",
      "to": "intent.screen_swallowing_safety",
      "version": "0.1.0",
      "provenance": {
        "created_by": {
          "type": "ai",
          "id": "codex-gpt5"
        },
        "created_at": "2026-07-14T00:00:00Z",
        "source_refs": [
          "docs/context/001-clinical-intent.md"
        ],
        "review_status": "unreviewed",
        "version": "0.1.0"
      }
    },
    {
      "id": "edge.swallowing-difficulty.003",
      "type": "SUGGESTS",
      "from": "rfe.swallowing_difficulty",
      "to": "intent.assess_swallowing_impact_and_context",
      "version": "0.1.0",
      "provenance": {
        "created_by": {
          "type": "ai",
          "id": "codex-gpt5"
        },
        "created_at": "2026-07-14T00:00:00Z",
        "source_refs": [
          "docs/context/001-clinical-intent.md"
        ],
        "review_status": "unreviewed",
        "version": "0.1.0"
      }
    },
    {
      "id": "edge.swallowing-difficulty.004",
      "type": "SUGGESTS",
      "from": "rfe.swallowing_difficulty",
      "to": "intent.prepare_swallowing_handoff",
      "version": "0.1.0",
      "provenance": {
        "created_by": {
          "type": "ai",
          "id": "codex-gpt5"
        },
        "created_at": "2026-07-14T00:00:00Z",
        "source_refs": [
          "docs/context/001-clinical-intent.md"
        ],
        "review_status": "unreviewed",
        "version": "0.1.0"
      }
    }
  ],
  "provenance": {
    "created_by": {
      "type": "ai",
      "id": "codex-gpt5"
    },
    "created_at": "2026-07-14T00:00:00Z",
    "source_refs": [
      "knowledge/catalog/primary-care-rfe.json"
    ],
    "review_status": "unreviewed",
    "version": "0.1.0"
  }
}
