{
  "id": "knowledge.primary-care-fatigue",
  "version": "0.1.0",
  "nodes": [
    {
      "id": "context.primary_care",
      "type": "EncounterContext",
      "display": "Primary Care",
      "version": "0.1.0",
      "status": "research_only",
      "provenance": {
        "created_by": {
          "type": "ai",
          "id": "codex-gpt5"
        },
        "created_at": "2026-07-14T00:00:00Z",
        "source_refs": [
          "docs/context/002-encounter-context.md"
        ],
        "review_status": "unreviewed",
        "version": "0.1.0"
      }
    },
    {
      "id": "rfe.fatigue",
      "type": "ReasonForEncounter",
      "display": "Fatigue or Lack of Energy",
      "version": "0.1.0",
      "status": "research_only",
      "provenance": {
        "created_by": {
          "type": "ai",
          "id": "codex-gpt5"
        },
        "created_at": "2026-07-14T00:00:00Z",
        "source_refs": [
          "knowledge/catalog/primary-care-rfe.json"
        ],
        "review_status": "unreviewed",
        "version": "0.1.0"
      }
    },
    {
      "id": "intent.characterize_symptom",
      "type": "ClinicalIntent",
      "display": "Characterize Onset Course Quality Severity Function and Recovery",
      "version": "0.1.0",
      "status": "research_only",
      "provenance": {
        "created_by": {
          "type": "ai",
          "id": "codex-gpt5"
        },
        "created_at": "2026-07-14T00:00:00Z",
        "source_refs": [
          "docs/context/001-clinical-intent.md"
        ],
        "review_status": "unreviewed",
        "version": "0.1.0"
      }
    },
    {
      "id": "intent.screen_red_flags",
      "type": "ClinicalIntent",
      "display": "Screen Neurologic Cardiopulmonary Bleeding Infection Mental Health Toxic and Life Stage Warning Features",
      "version": "0.1.0",
      "status": "research_only",
      "provenance": {
        "created_by": {
          "type": "ai",
          "id": "codex-gpt5"
        },
        "created_at": "2026-07-14T00:00:00Z",
        "source_refs": [
          "docs/context/001-clinical-intent.md"
        ],
        "review_status": "unreviewed",
        "version": "0.1.0"
      }
    },
    {
      "id": "intent.differentiate_common_causes",
      "type": "ClinicalIntent",
      "display": "Describe Sleep Activity Mood Systemic Metabolic Reproductive Medicine and Exposure Context",
      "version": "0.1.0",
      "status": "research_only",
      "provenance": {
        "created_by": {
          "type": "ai",
          "id": "codex-gpt5"
        },
        "created_at": "2026-07-14T00:00:00Z",
        "source_refs": [
          "docs/context/001-clinical-intent.md"
        ],
        "review_status": "unreviewed",
        "version": "0.1.0"
      }
    },
    {
      "id": "intent.risk_assessment",
      "type": "ClinicalIntent",
      "display": "Assess History Medicines Tests Treatment Source Reliability and Patient Goals",
      "version": "0.1.0",
      "status": "research_only",
      "provenance": {
        "created_by": {
          "type": "ai",
          "id": "codex-gpt5"
        },
        "created_at": "2026-07-14T00:00:00Z",
        "source_refs": [
          "docs/context/001-clinical-intent.md"
        ],
        "review_status": "unreviewed",
        "version": "0.1.0"
      }
    }
  ],
  "edges": [
    {
      "id": "edge.fatigue.000",
      "type": "ACTIVATES",
      "from": "context.primary_care",
      "to": "intent.characterize_symptom",
      "version": "0.1.0",
      "provenance": {
        "created_by": {
          "type": "ai",
          "id": "codex-gpt5"
        },
        "created_at": "2026-07-14T00:00:00Z",
        "source_refs": [
          "docs/context/002-encounter-context.md"
        ],
        "review_status": "unreviewed",
        "version": "0.1.0"
      }
    },
    {
      "id": "edge.fatigue.001",
      "type": "SUGGESTS",
      "from": "rfe.fatigue",
      "to": "intent.characterize_symptom",
      "version": "0.1.0",
      "provenance": {
        "created_by": {
          "type": "ai",
          "id": "codex-gpt5"
        },
        "created_at": "2026-07-14T00:00:00Z",
        "source_refs": [
          "docs/context/001-clinical-intent.md"
        ],
        "review_status": "unreviewed",
        "version": "0.1.0"
      }
    },
    {
      "id": "edge.fatigue.002",
      "type": "SUGGESTS",
      "from": "rfe.fatigue",
      "to": "intent.screen_red_flags",
      "version": "0.1.0",
      "provenance": {
        "created_by": {
          "type": "ai",
          "id": "codex-gpt5"
        },
        "created_at": "2026-07-14T00:00:00Z",
        "source_refs": [
          "docs/context/001-clinical-intent.md"
        ],
        "review_status": "unreviewed",
        "version": "0.1.0"
      }
    },
    {
      "id": "edge.fatigue.003",
      "type": "SUGGESTS",
      "from": "rfe.fatigue",
      "to": "intent.differentiate_common_causes",
      "version": "0.1.0",
      "provenance": {
        "created_by": {
          "type": "ai",
          "id": "codex-gpt5"
        },
        "created_at": "2026-07-14T00:00:00Z",
        "source_refs": [
          "docs/context/001-clinical-intent.md"
        ],
        "review_status": "unreviewed",
        "version": "0.1.0"
      }
    },
    {
      "id": "edge.fatigue.004",
      "type": "SUGGESTS",
      "from": "rfe.fatigue",
      "to": "intent.risk_assessment",
      "version": "0.1.0",
      "provenance": {
        "created_by": {
          "type": "ai",
          "id": "codex-gpt5"
        },
        "created_at": "2026-07-14T00:00:00Z",
        "source_refs": [
          "docs/context/001-clinical-intent.md"
        ],
        "review_status": "unreviewed",
        "version": "0.1.0"
      }
    }
  ],
  "provenance": {
    "created_by": {
      "type": "ai",
      "id": "codex-gpt5"
    },
    "created_at": "2026-07-14T00:00:00Z",
    "source_refs": [
      "knowledge/catalog/primary-care-rfe.json"
    ],
    "review_status": "unreviewed",
    "version": "0.1.0"
  }
}
