{
  "id": "knowledge.primary-care-test-result-follow-up",
  "version": "0.1.0",
  "nodes": [
    {
      "id": "context.primary_care",
      "type": "EncounterContext",
      "display": "Primary Care",
      "version": "0.1.0",
      "status": "research_only",
      "provenance": {
        "created_by": {
          "type": "ai",
          "id": "codex-gpt5"
        },
        "created_at": "2026-07-14T00:00:00Z",
        "source_refs": [
          "docs/context/002-encounter-context.md"
        ],
        "review_status": "unreviewed",
        "version": "0.1.0"
      }
    },
    {
      "id": "rfe.test_result_follow_up",
      "type": "ReasonForEncounter",
      "display": "Test Result Follow-up",
      "version": "0.1.0",
      "status": "research_only",
      "provenance": {
        "created_by": {
          "type": "ai",
          "id": "codex-gpt5"
        },
        "created_at": "2026-07-14T00:00:00Z",
        "source_refs": [
          "knowledge/catalog/primary-care-rfe.json"
        ],
        "review_status": "unreviewed",
        "version": "0.1.0"
      }
    },
    {
      "id": "intent.characterize_result_follow_up",
      "type": "ClinicalIntent",
      "display": "Clarify Result Follow-up Goal",
      "version": "0.1.0",
      "status": "research_only",
      "provenance": {
        "created_by": {
          "type": "ai",
          "id": "codex-gpt5"
        },
        "created_at": "2026-07-14T00:00:00Z",
        "source_refs": [
          "docs/context/001-clinical-intent.md"
        ],
        "review_status": "unreviewed",
        "version": "0.1.0"
      }
    },
    {
      "id": "intent.screen_result_follow_up_safety",
      "type": "ClinicalIntent",
      "display": "Screen Explicit Result Follow-up Safety Instructions",
      "version": "0.1.0",
      "status": "research_only",
      "provenance": {
        "created_by": {
          "type": "ai",
          "id": "codex-gpt5"
        },
        "created_at": "2026-07-14T00:00:00Z",
        "source_refs": [
          "docs/context/001-clinical-intent.md"
        ],
        "review_status": "unreviewed",
        "version": "0.1.0"
      }
    },
    {
      "id": "intent.prepare_result_clinician_handoff",
      "type": "ClinicalIntent",
      "display": "Prepare Result Identity Content Source and Follow-up Handoff",
      "version": "0.1.0",
      "status": "research_only",
      "provenance": {
        "created_by": {
          "type": "ai",
          "id": "codex-gpt5"
        },
        "created_at": "2026-07-14T00:00:00Z",
        "source_refs": [
          "docs/context/001-clinical-intent.md"
        ],
        "review_status": "unreviewed",
        "version": "0.1.0"
      }
    }
  ],
  "edges": [
    {
      "id": "edge.test-result-follow-up.000",
      "type": "ACTIVATES",
      "from": "context.primary_care",
      "to": "intent.characterize_result_follow_up",
      "version": "0.1.0",
      "provenance": {
        "created_by": {
          "type": "ai",
          "id": "codex-gpt5"
        },
        "created_at": "2026-07-14T00:00:00Z",
        "source_refs": [
          "docs/context/002-encounter-context.md"
        ],
        "review_status": "unreviewed",
        "version": "0.1.0"
      }
    },
    {
      "id": "edge.test-result-follow-up.001",
      "type": "SUGGESTS",
      "from": "rfe.test_result_follow_up",
      "to": "intent.characterize_result_follow_up",
      "version": "0.1.0",
      "provenance": {
        "created_by": {
          "type": "ai",
          "id": "codex-gpt5"
        },
        "created_at": "2026-07-14T00:00:00Z",
        "source_refs": [
          "docs/context/001-clinical-intent.md"
        ],
        "review_status": "unreviewed",
        "version": "0.1.0"
      }
    },
    {
      "id": "edge.test-result-follow-up.002",
      "type": "SUGGESTS",
      "from": "rfe.test_result_follow_up",
      "to": "intent.screen_result_follow_up_safety",
      "version": "0.1.0",
      "provenance": {
        "created_by": {
          "type": "ai",
          "id": "codex-gpt5"
        },
        "created_at": "2026-07-14T00:00:00Z",
        "source_refs": [
          "docs/context/001-clinical-intent.md"
        ],
        "review_status": "unreviewed",
        "version": "0.1.0"
      }
    },
    {
      "id": "edge.test-result-follow-up.003",
      "type": "SUGGESTS",
      "from": "rfe.test_result_follow_up",
      "to": "intent.prepare_result_clinician_handoff",
      "version": "0.1.0",
      "provenance": {
        "created_by": {
          "type": "ai",
          "id": "codex-gpt5"
        },
        "created_at": "2026-07-14T00:00:00Z",
        "source_refs": [
          "docs/context/001-clinical-intent.md"
        ],
        "review_status": "unreviewed",
        "version": "0.1.0"
      }
    }
  ],
  "provenance": {
    "created_by": {
      "type": "ai",
      "id": "codex-gpt5"
    },
    "created_at": "2026-07-14T00:00:00Z",
    "source_refs": [
      "knowledge/catalog/primary-care-rfe.json"
    ],
    "review_status": "unreviewed",
    "version": "0.1.0"
  }
}
