{
  "id": "knowledge.primary-care-joint-limb",
  "version": "0.1.0",
  "nodes": [
    {
      "id": "context.primary_care",
      "type": "EncounterContext",
      "display": "Primary Care",
      "version": "0.1.0",
      "status": "research_only",
      "provenance": {
        "created_by": {
          "type": "ai",
          "id": "codex-gpt5"
        },
        "created_at": "2026-07-14T00:00:00Z",
        "source_refs": [
          "docs/context/002-encounter-context.md"
        ],
        "review_status": "unreviewed",
        "version": "0.1.0"
      }
    },
    {
      "id": "rfe.joint_limb_complaint",
      "type": "ReasonForEncounter",
      "display": "Joint or Limb Complaint",
      "version": "0.1.0",
      "status": "research_only",
      "provenance": {
        "created_by": {
          "type": "ai",
          "id": "codex-gpt5"
        },
        "created_at": "2026-07-14T00:00:00Z",
        "source_refs": [
          "knowledge/catalog/primary-care-rfe.json"
        ],
        "review_status": "unreviewed",
        "version": "0.1.0"
      }
    },
    {
      "id": "intent.characterize_symptom",
      "type": "ClinicalIntent",
      "display": "Characterize Symptom",
      "version": "0.1.0",
      "status": "research_only",
      "provenance": {
        "created_by": {
          "type": "ai",
          "id": "codex-gpt5"
        },
        "created_at": "2026-07-14T00:00:00Z",
        "source_refs": [
          "docs/context/001-clinical-intent.md"
        ],
        "review_status": "unreviewed",
        "version": "0.1.0"
      }
    },
    {
      "id": "intent.screen_red_flags",
      "type": "ClinicalIntent",
      "display": "Screen Red Flags",
      "version": "0.1.0",
      "status": "research_only",
      "provenance": {
        "created_by": {
          "type": "ai",
          "id": "codex-gpt5"
        },
        "created_at": "2026-07-14T00:00:00Z",
        "source_refs": [
          "docs/context/001-clinical-intent.md"
        ],
        "review_status": "unreviewed",
        "version": "0.1.0"
      }
    },
    {
      "id": "intent.differentiate_common_causes",
      "type": "ClinicalIntent",
      "display": "Differentiate Common Sources",
      "version": "0.1.0",
      "status": "research_only",
      "provenance": {
        "created_by": {
          "type": "ai",
          "id": "codex-gpt5"
        },
        "created_at": "2026-07-14T00:00:00Z",
        "source_refs": [
          "docs/context/001-clinical-intent.md"
        ],
        "review_status": "unreviewed",
        "version": "0.1.0"
      }
    },
    {
      "id": "intent.risk_assessment",
      "type": "ClinicalIntent",
      "display": "Risk Assessment",
      "version": "0.1.0",
      "status": "research_only",
      "provenance": {
        "created_by": {
          "type": "ai",
          "id": "codex-gpt5"
        },
        "created_at": "2026-07-14T00:00:00Z",
        "source_refs": [
          "docs/context/001-clinical-intent.md"
        ],
        "review_status": "unreviewed",
        "version": "0.1.0"
      }
    }
  ],
  "edges": [
    {
      "id": "edge.joint-limb.000",
      "type": "ACTIVATES",
      "from": "context.primary_care",
      "to": "intent.characterize_symptom",
      "version": "0.1.0",
      "provenance": {
        "created_by": {
          "type": "ai",
          "id": "codex-gpt5"
        },
        "created_at": "2026-07-14T00:00:00Z",
        "source_refs": [
          "docs/context/002-encounter-context.md"
        ],
        "review_status": "unreviewed",
        "version": "0.1.0"
      }
    },
    {
      "id": "edge.joint-limb.001",
      "type": "SUGGESTS",
      "from": "rfe.joint_limb_complaint",
      "to": "intent.characterize_symptom",
      "version": "0.1.0",
      "provenance": {
        "created_by": {
          "type": "ai",
          "id": "codex-gpt5"
        },
        "created_at": "2026-07-14T00:00:00Z",
        "source_refs": [
          "docs/context/001-clinical-intent.md"
        ],
        "review_status": "unreviewed",
        "version": "0.1.0"
      }
    },
    {
      "id": "edge.joint-limb.002",
      "type": "SUGGESTS",
      "from": "rfe.joint_limb_complaint",
      "to": "intent.screen_red_flags",
      "version": "0.1.0",
      "provenance": {
        "created_by": {
          "type": "ai",
          "id": "codex-gpt5"
        },
        "created_at": "2026-07-14T00:00:00Z",
        "source_refs": [
          "docs/context/001-clinical-intent.md"
        ],
        "review_status": "unreviewed",
        "version": "0.1.0"
      }
    },
    {
      "id": "edge.joint-limb.003",
      "type": "SUGGESTS",
      "from": "rfe.joint_limb_complaint",
      "to": "intent.differentiate_common_causes",
      "version": "0.1.0",
      "provenance": {
        "created_by": {
          "type": "ai",
          "id": "codex-gpt5"
        },
        "created_at": "2026-07-14T00:00:00Z",
        "source_refs": [
          "docs/context/001-clinical-intent.md"
        ],
        "review_status": "unreviewed",
        "version": "0.1.0"
      }
    },
    {
      "id": "edge.joint-limb.004",
      "type": "SUGGESTS",
      "from": "rfe.joint_limb_complaint",
      "to": "intent.risk_assessment",
      "version": "0.1.0",
      "provenance": {
        "created_by": {
          "type": "ai",
          "id": "codex-gpt5"
        },
        "created_at": "2026-07-14T00:00:00Z",
        "source_refs": [
          "docs/context/001-clinical-intent.md"
        ],
        "review_status": "unreviewed",
        "version": "0.1.0"
      }
    }
  ],
  "provenance": {
    "created_by": {
      "type": "ai",
      "id": "codex-gpt5"
    },
    "created_at": "2026-07-14T00:00:00Z",
    "source_refs": [
      "knowledge/catalog/primary-care-rfe.json"
    ],
    "review_status": "unreviewed",
    "version": "0.1.0"
  }
}
